{
  "schema_version": "1.0.0",
  "actor_ref": "actor--poseidon-group",
  "generated_at": "2026-09-20T12:21:15Z",
  "sources": [
    {
      "source_id": "source--poseidon-group--b291669877e32a4f",
      "path": "actor_profile/evidence/poseidon-group.csv",
      "published_at": {
        "value": null,
        "precision": "unknown",
        "status": "unknown",
        "basis": "not-stated"
      },
      "confidence": "medium",
      "tlp": "TLP:CLEAR",
      "analyst_notes": ""
    }
  ],
  "indicators": [],
  "ingestion": {
    "source_count": 1,
    "processed_source_count": 1,
    "error_source_count": 0,
    "candidate_count": 0,
    "errors": []
  }
}
