{
  "schema_version": "1.0.0",
  "actor_ref": "actor--ta578",
  "generated_at": "2026-09-20T12:21:28Z",
  "sources": [
    {
      "source_id": "source--ta578--3b6e0cf5d9740894",
      "path": "actor_profile/evidence/ta578.csv",
      "published_at": {
        "value": null,
        "precision": "unknown",
        "status": "unknown",
        "basis": "not-stated"
      },
      "confidence": "medium",
      "tlp": "TLP:CLEAR",
      "analyst_notes": ""
    }
  ],
  "indicators": [],
  "ingestion": {
    "source_count": 1,
    "processed_source_count": 1,
    "error_source_count": 0,
    "candidate_count": 0,
    "errors": []
  }
}
