{
  "schema_version": "1.0.0",
  "actor_ref": "actor--tag-127",
  "generated_at": "2026-09-20T12:21:29Z",
  "sources": [
    {
      "source_id": "source--tag-127--fb00569bab7740a3",
      "path": "actor_profile/evidence/tag-127.csv",
      "published_at": {
        "value": null,
        "precision": "unknown",
        "status": "unknown",
        "basis": "not-stated"
      },
      "confidence": "medium",
      "tlp": "TLP:CLEAR",
      "analyst_notes": ""
    }
  ],
  "indicators": [],
  "ingestion": {
    "source_count": 1,
    "processed_source_count": 1,
    "error_source_count": 0,
    "candidate_count": 0,
    "errors": []
  }
}
