{
  "schema_version": "1.0.0",
  "actor_ref": "actor--unc6485",
  "generated_at": "2026-09-20T12:21:40Z",
  "sources": [
    {
      "source_id": "source--unc6485--3a4438f1a2026416",
      "path": "UNC****/UNC6485/readme.md",
      "published_at": {
        "value": null,
        "precision": "unknown",
        "status": "unknown",
        "basis": "not-stated"
      },
      "confidence": "medium",
      "tlp": "TLP:CLEAR",
      "analyst_notes": ""
    }
  ],
  "indicators": [],
  "ingestion": {
    "source_count": 1,
    "processed_source_count": 1,
    "error_source_count": 0,
    "candidate_count": 0,
    "errors": []
  }
}
