{
  "schema_version": "1.0.0",
  "actor_ref": "actor--moses-staff",
  "generated_at": "2026-09-21T02:23:28Z",
  "sources": [
    {
      "source_id": "source--moses-staff--a012ff383717e545",
      "path": "actor_profile/evidence/moses-staff.csv",
      "published_at": {
        "value": null,
        "precision": "unknown",
        "status": "unknown",
        "basis": "not-stated"
      },
      "confidence": "medium",
      "tlp": "TLP:CLEAR",
      "analyst_notes": ""
    }
  ],
  "indicators": [
    {
      "indicator_id": "indicator--sha256:7c6ea4fb6a15a3e2c68567be9038c7579a390ef75763d786b91719916dbd40fb",
      "type": "domain",
      "value": "malicious.py",
      "normalized_value": "malicious.py",
      "stix_pattern": "[domain-name:value = 'malicious.py']",
      "disposition": "confirmed",
      "first_observed": {
        "value": null,
        "precision": "unknown",
        "status": "unknown",
        "basis": "not-stated"
      },
      "last_observed": {
        "value": null,
        "precision": "unknown",
        "status": "unknown",
        "basis": "not-stated"
      },
      "observation_count": 1,
      "campaign_count": 0,
      "seen_in_multiple_campaigns": false,
      "campaign_refs": [],
      "malware_refs": [],
      "infrastructure_refs": [],
      "roles": [],
      "observations": [
        {
          "observation_id": "observation--sha256:82aea56a8365cd4c172eef56900a57d1506812f47571045cfe0c9558645a9069",
          "observed_at": {
            "value": null,
            "precision": "unknown",
            "status": "unknown",
            "basis": "not-stated"
          },
          "source_published_at": {
            "value": null,
            "precision": "unknown",
            "status": "unknown",
            "basis": "not-stated"
          },
          "source_id": "source--moses-staff--a012ff383717e545",
          "source_path": "actor_profile/evidence/moses-staff.csv",
          "source_location": {
            "row": 18
          },
          "campaign_refs": [],
          "malware_refs": [],
          "infrastructure_refs": [],
          "roles": [],
          "confidence": "medium",
          "tlp": "TLP:CLEAR",
          "extraction_method": "csv-row",
          "context_excerpt": "summary/2023/RedReport2023-Picus.pdf {\"page\": 34} Moses Staff eover, both the svchost.exe and fuse are compiled using PyInstaller, bundling all the necessary libraries and Python runtime to initiate the execution of the malicious.py [31]. 34 3. Data Encryption for Impact (T1486) Moses Staff, suspected to be an Iranian threat group, leverages the Python’s secure hash and message digest algorithm library called hashlib to generate symmetric keys used during the encryption process [32]. In this scr",
          "analyst_notes": "",
          "raw_value": "malicious.py"
        }
      ]
    }
  ],
  "ingestion": {
    "source_count": 1,
    "processed_source_count": 1,
    "error_source_count": 0,
    "candidate_count": 0,
    "errors": []
  }
}
