{
  "schema_version": "1.0.0",
  "actor_ref": "actor--wild-neutron",
  "generated_at": "2026-09-21T02:23:59Z",
  "sources": [
    {
      "source_id": "source--wild-neutron--09df39b8c404faac",
      "path": "actor_profile/evidence/wild-neutron.csv",
      "published_at": {
        "value": null,
        "precision": "unknown",
        "status": "unknown",
        "basis": "not-stated"
      },
      "confidence": "medium",
      "tlp": "TLP:CLEAR",
      "analyst_notes": ""
    }
  ],
  "indicators": [
    {
      "indicator_id": "indicator--sha256:cf13623a6be35457c34faa97e986a08543b25367bbf121218c90b2e44e64f50b",
      "type": "url",
      "value": "https://www.facebook.co",
      "normalized_value": "https://www.facebook.co/",
      "stix_pattern": "[url:value = 'https://www.facebook.co/']",
      "disposition": "candidate",
      "first_observed": {
        "value": null,
        "precision": "unknown",
        "status": "unknown",
        "basis": "not-stated"
      },
      "last_observed": {
        "value": null,
        "precision": "unknown",
        "status": "unknown",
        "basis": "not-stated"
      },
      "observation_count": 1,
      "campaign_count": 0,
      "seen_in_multiple_campaigns": false,
      "campaign_refs": [],
      "malware_refs": [],
      "infrastructure_refs": [],
      "roles": [],
      "observations": [
        {
          "observation_id": "observation--sha256:30632e26f453182034441b5e21861ab8f160248bb46a43b1e2c1e24ebc72d885",
          "observed_at": {
            "value": null,
            "precision": "unknown",
            "status": "unknown",
            "basis": "not-stated"
          },
          "source_published_at": {
            "value": null,
            "precision": "unknown",
            "status": "unknown",
            "basis": "not-stated"
          },
          "source_id": "source--wild-neutron--09df39b8c404faac",
          "source_path": "actor_profile/evidence/wild-neutron.csv",
          "source_location": {
            "row": 17
          },
          "campaign_refs": [],
          "malware_refs": [],
          "infrastructure_refs": [],
          "roles": [],
          "confidence": "medium",
          "tlp": "TLP:CLEAR",
          "extraction_method": "csv-row",
          "context_excerpt": "Threat_Group_Cards_v2.0.pdf {\"page\": 364} JripBot Real estate, lawyers and individual users. Countries: Algeria, Australia, Austria, Canada, France, Germany, Kazakhstan, Palestine, Poland, Russia, Slovenia, Spain, Switzerland, UAE, UK and USA. Tools used HesperBot, JripBot and many 0-days vulnerabilities. Operations performed Jan 2013 Attack on Twitter <https://blog.twitter.com/official/en_us/a/2013/keeping-our-users- secure.html> Feb 2013 Attack on Facebook <https://www.facebook.co",
          "analyst_notes": "",
          "raw_value": "https://www.facebook.co"
        }
      ]
    }
  ],
  "ingestion": {
    "source_count": 1,
    "processed_source_count": 1,
    "error_source_count": 0,
    "candidate_count": 1,
    "errors": []
  }
}
