{
  "schema_version": "1.0.0",
  "actor_ref": "actor--nettraveler",
  "generated_at": "2026-09-21T02:23:28Z",
  "sources": [
    {
      "source_id": "source--nettraveler--268f9b2065c15023",
      "path": "actor_profile/evidence/nettraveler.csv",
      "published_at": {
        "value": null,
        "precision": "unknown",
        "status": "unknown",
        "basis": "not-stated"
      },
      "confidence": "medium",
      "tlp": "TLP:CLEAR",
      "analyst_notes": ""
    }
  ],
  "indicators": [],
  "ingestion": {
    "source_count": 1,
    "processed_source_count": 1,
    "error_source_count": 0,
    "candidate_count": 0,
    "errors": []
  }
}
