{
  "schema_version": "1.0.0",
  "actor_ref": "actor--poseidon",
  "generated_at": "2026-09-20T12:21:15Z",
  "sources": [
    {
      "source_id": "source--poseidon--be803361a372975c",
      "path": "actor_profile/evidence/poseidon.csv",
      "published_at": {
        "value": null,
        "precision": "unknown",
        "status": "unknown",
        "basis": "not-stated"
      },
      "confidence": "medium",
      "tlp": "TLP:CLEAR",
      "analyst_notes": ""
    }
  ],
  "indicators": [
    {
      "indicator_id": "indicator--sha256:ad5dee0077bdd40d5b9bedb7a587b7f7786b6f8f5a6409563a81f35f6811afa1",
      "type": "sha1",
      "value": "c3e48c2a2d43c752121e55b909fc705fe4fdaef6",
      "normalized_value": "c3e48c2a2d43c752121e55b909fc705fe4fdaef6",
      "stix_pattern": "[file:hashes.'SHA-1' = 'c3e48c2a2d43c752121e55b909fc705fe4fdaef6']",
      "disposition": "candidate",
      "first_observed": {
        "value": null,
        "precision": "unknown",
        "status": "unknown",
        "basis": "not-stated"
      },
      "last_observed": {
        "value": null,
        "precision": "unknown",
        "status": "unknown",
        "basis": "not-stated"
      },
      "observation_count": 1,
      "campaign_count": 0,
      "seen_in_multiple_campaigns": false,
      "campaign_refs": [],
      "malware_refs": [],
      "infrastructure_refs": [],
      "roles": [],
      "observations": [
        {
          "observation_id": "observation--sha256:930b45eb6b5a437fc85adf5fcc0a2b6764dffef58146ca9636413fb18eff3bfe",
          "observed_at": {
            "value": null,
            "precision": "unknown",
            "status": "unknown",
            "basis": "not-stated"
          },
          "source_published_at": {
            "value": null,
            "precision": "unknown",
            "status": "unknown",
            "basis": "not-stated"
          },
          "source_id": "source--poseidon--be803361a372975c",
          "source_path": "actor_profile/evidence/poseidon.csv",
          "source_location": {
            "row": 27
          },
          "campaign_refs": [],
          "malware_refs": [],
          "infrastructure_refs": [],
          "roles": [],
          "confidence": "medium",
          "tlp": "TLP:CLEAR",
          "extraction_method": "csv-row",
          "context_excerpt": "summary/2022/top-10-macos-malware-discoveries-in-2022.pdf {\"page\": 1} Poseidon e529588502bc08 (Client) c3e48c2a2d43c752121e55b909fc705fe4fdaef6 (Client) 4. CrateDepression Reported on by SentinelLabs in May, CrateDepression was a supply chain attack on the Rust development community which dropped Poseidon payloads on its victims. Threat actors had hosted a malcious crate named ‘rustdecimal’ on crates.io, a typosquat of the genuine crate, rust_decimal. The malware inspects infected machines for t",
          "analyst_notes": "",
          "raw_value": "c3e48c2a2d43c752121e55b909fc705fe4fdaef6"
        }
      ]
    },
    {
      "indicator_id": "indicator--sha256:8c69ad0257dcbbcded6ea275ad88958fafd57ed2c0a36e57bb3570eb45edbfb2",
      "type": "url",
      "value": "https://cybernews.com/security/poseidon-malware-infostealer-macos-users-arc-browser/",
      "normalized_value": "https://cybernews.com/security/poseidon-malware-infostealer-macos-users-arc-browser/",
      "stix_pattern": "[url:value = 'https://cybernews.com/security/poseidon-malware-infostealer-macos-users-arc-browser/']",
      "disposition": "candidate",
      "first_observed": {
        "value": null,
        "precision": "unknown",
        "status": "unknown",
        "basis": "not-stated"
      },
      "last_observed": {
        "value": null,
        "precision": "unknown",
        "status": "unknown",
        "basis": "not-stated"
      },
      "observation_count": 1,
      "campaign_count": 0,
      "seen_in_multiple_campaigns": false,
      "campaign_refs": [],
      "malware_refs": [],
      "infrastructure_refs": [],
      "roles": [],
      "observations": [
        {
          "observation_id": "observation--sha256:93a30777fb49edaffca50d420e207e3dccb362c80f72c0f1e201a91b82702eaf",
          "observed_at": {
            "value": null,
            "precision": "unknown",
            "status": "unknown",
            "basis": "not-stated"
          },
          "source_published_at": {
            "value": null,
            "precision": "unknown",
            "status": "unknown",
            "basis": "not-stated"
          },
          "source_id": "source--poseidon--be803361a372975c",
          "source_path": "actor_profile/evidence/poseidon.csv",
          "source_location": {
            "row": 19
          },
          "campaign_refs": [],
          "malware_refs": [],
          "infrastructure_refs": [],
          "roles": [],
          "confidence": "medium",
          "tlp": "TLP:CLEAR",
          "extraction_method": "csv-row",
          "context_excerpt": "parse-daily/.cache/tech-memo/daily-news/news/2024_04-06/20240629.md {\"line\": 219} poseidon https://cybernews.com/security/poseidon-malware-infostealer-macos-users-arc-browser/",
          "analyst_notes": "",
          "raw_value": "https://cybernews.com/security/poseidon-malware-infostealer-macos-users-arc-browser/"
        }
      ]
    },
    {
      "indicator_id": "indicator--sha256:1a605bc0ade505f1a75b49c4737b9cec1df644c45b2b71145b97838aac369cb2",
      "type": "url",
      "value": "https://cybersecuritynews.com/new-spear-phishing-attack-abusing-google-ads/.review_notes",
      "normalized_value": "https://cybersecuritynews.com/new-spear-phishing-attack-abusing-google-ads/.review_notes",
      "stix_pattern": "[url:value = 'https://cybersecuritynews.com/new-spear-phishing-attack-abusing-google-ads/.review_notes']",
      "disposition": "candidate",
      "first_observed": {
        "value": null,
        "precision": "unknown",
        "status": "unknown",
        "basis": "not-stated"
      },
      "last_observed": {
        "value": null,
        "precision": "unknown",
        "status": "unknown",
        "basis": "not-stated"
      },
      "observation_count": 1,
      "campaign_count": 0,
      "seen_in_multiple_campaigns": false,
      "campaign_refs": [],
      "malware_refs": [],
      "infrastructure_refs": [],
      "roles": [],
      "observations": [
        {
          "observation_id": "observation--sha256:29ce3b04e0b2adbfd738fcd0690831349ea9644ec8aa8050a2a71fa76dc4e2c5",
          "observed_at": {
            "value": null,
            "precision": "unknown",
            "status": "unknown",
            "basis": "not-stated"
          },
          "source_published_at": {
            "value": null,
            "precision": "unknown",
            "status": "unknown",
            "basis": "not-stated"
          },
          "source_id": "source--poseidon--be803361a372975c",
          "source_path": "actor_profile/evidence/poseidon.csv",
          "source_location": {
            "row": 26
          },
          "campaign_refs": [],
          "malware_refs": [],
          "infrastructure_refs": [],
          "roles": [],
          "confidence": "medium",
          "tlp": "TLP:CLEAR",
          "extraction_method": "csv-row",
          "context_excerpt": "parse-daily/review-decisions.json {\"json_path\": \"$.konni|https://cybersecuritynews.com/new-spear-phishing-attack-abusing-google-ads/.review_notes\"} Poseidon tech-memo全履歴再監査: 記事要約の同一文で当該アクターが攻撃活動の実行主体として明記されている。攻撃期間は一次資料中の明示値を別途確認できていないためunknownとし、記事公開日はreported_atとして分離する。 根拠: - 韓国組織を狙うKonni APTの作戦「Poseidon」が確認され、Google広告基盤を悪用してEndRATを配布するスピアフィッシングを実施。",
          "analyst_notes": "",
          "raw_value": "https://cybersecuritynews.com/new-spear-phishing-attack-abusing-google-ads/.review_notes"
        }
      ]
    }
  ],
  "ingestion": {
    "source_count": 1,
    "processed_source_count": 1,
    "error_source_count": 0,
    "candidate_count": 3,
    "errors": []
  }
}
